rule_label,rule_error_message,rule_cross_file_flag,file_type,severity_name,target_file,query_name,expected_value,category
FABS31.2.2,"AwardeeOrRecipientUEI is required where ActionDate is after October 1, 2010, unless the record is an aggregate or PII-redacted non-aggregate record (RecordType = 1 or 3) or the recipient is an individual (BusinessTypes includes 'P'). For AssistanceType 06, 07, 08, 09, 10, or 11, if the base award (the earliest record with the same unique award key) has an ActionDate prior to October 1, 2022, this will produce a warning rather than a fatal error.",n,fabs,warning,,fabs31_2_2,"AwardeeOrRecipientUEI is required.","completeness"
FABS31.3,"When AwardeeOrRecipientUEI is provided, it must be twelve characters.",n,fabs,fatal,,fabs31_3,"AwardeeOrRecipientUEI must be 12 characters.","accuracy"
FABS31.4,"When provided, AwardeeOrRecipientUEI must be registered (not necessarily active) in SAM, unless the ActionDate is before October 1, 2010.",n,fabs,fatal,,fabs31_4,"AwardeeOrRecipientUEI must be registered in SAM","existence"
FABS31.5,"When ActionDate is after October 1, 2010 and ActionType = A, AwardeeOrRecipientUEI should (when provided) have an active registration in SAM as of the ActionDate.",n,fabs,warning,,fabs31_5,"AwardeeOrRecipientUEI must be active in SAM","existence"
FABS31.7,"When ActionDate is after October 1, 2010 and ActionType = B, C, or D, AwardeeOrRecipientUEI should (when provided) have an active registration in SAM as of the ActionDate, except where FederalActionObligation is <=0 and ActionType = D.",n,fabs,warning,,fabs31_7,"AwardeeOrRecipientUEI should be active in SAM","existence"
FABS32.1,"PeriodOfPerformanceStartDate is an optional field, but when provided, must follow YYYYMMDD format, where YYYY is the year, MM the month and DD the day.",n,fabs,fatal,,fabs32_1,"PeriodOfPerformanceStartDate must follow the YYYYMMDD format.","accuracy"
FABS32.2,"When provided, PeriodOfPerformanceStartDate should be a valid date between 19991001 and 20991231.",n,fabs,warning,,fabs32_2,"between 10/1/1999 and 12/31/2099","accuracy"
FABS33.1,"PeriodOfPerformanceCurrentEndDate is an optional field, but when provided, must follow YYYYMMDD format, where YYYY is the year, MM the month and DD the day.",n,fabs,fatal,,fabs33_1,"PeriodOfPerformanceCurrentEndDate must follow the YYYYMMDD format.","accuracy"
FABS33.2,"When provided, PeriodOfPerformanceCurrentEndDate must be a valid date between 19991001 and 20991231.",n,fabs,fatal,,fabs33_2,"between 10/1/1999 and 12/31/2099","accuracy"
FABS34.1,"When both are provided, PeriodOfPerformanceStartDate must occur on or before PeriodOfPerformanceCurrentEndDate.",n,fabs,fatal,,fabs34_1,"less than or equal to [PeriodOfPerformanceCurrentEndDate]","accuracy"
FABS34.2,"While they are optional fields, if either PeriodOfPerformanceCurrentEndDate or PeriodOfPerformanceStartDate is provided, both fields should be provided.",n,fabs,warning,,fabs34_2,"both or neither PeriodOfPerformanceStartDate and PeriodOfPerformanceCurrentEndDate should be provided","completeness"
FABS35.1,"When provided, LegalEntityZIPLast4 must be in the #### format.",n,fabs,fatal,,fabs35_1,"Four digits need to be provided.","accuracy"
FABS35.2,"LegalEntityZIP5 must be a valid 5-digit USPS ZIP code.",n,fabs,fatal,,fabs35_2,"The ZIP code needs to be a valid 5-digit code.","existence"
FABS35.3,"The combination of LegalEntityZIP5 and LegalEntityZIPLast4 should be a valid 9-digit USPS ZIP+4 code.",n,fabs,warning,,fabs35_3,"The ZIP+4 code needs to be a valid USPS code.","existence"
FABS36,"CFDA_Number must be in XX.XXX format, where # represents a number from 0 to 9.",n,fabs,fatal,,fabs36,"The CFDA_Number must consist of two digits, a period, and then three digits.","accuracy"
FABS37.1,"For new (ActionType = A) or mixed aggregate (ActionType = E) assistance awards specifically, the CFDA_Number must be active as of the ActionDate. This does not apply to correction records (those with CorrectionDeleteIndicator = C and delete records).",n,fabs,fatal,,fabs37_1,"The CFDA_Number must be active","existence"
FABS37.2,"For non-new assistance awards (ActionType = B, C, or D), the CFDA_Number need not be active as of the ActionDate, but a warning will trigger in this case. This warning will not trigger for correction records (those with CorrectionDeleteIndicator = C).",n,fabs,warning,,fabs37_2,"The CFDA_Number should be active","existence"
FABS37.3,"CFDA_Number must have been registered with CFDA.gov or registered as an Assistance Listing on SAM.gov (post-May 2018) at some point in time.",n,fabs,fatal,,fabs37_3,"The CFDA_Number must be registered","existence"
FABS38.1,"FundingOfficeCode must be submitted for new awards (ActionType = A) or mixed aggregate records (ActionType = E) whose ActionDate is on or after October 1, 2018, and whose CorrectionDeleteIndicator is either Blank or C.",n,fabs,fatal,,fabs38_1,"FundingOfficeCode must be submitted for new awards made after 10/1/18","completeness"
FABS38.2.1,"When provided, FundingOfficeCode must be a valid value from the Federal Hierarchy, including being designated specifically as an Assistance Funding Office in the hierarchy. Since June 2019, the Federal Hierarchy has required that FundingOfficeCodes be flagged as either a Procurement Funding Office or an Assistance Funding Office (or both). The initial implementation of this distinction in FABS will allow either type to be acceptable.",n,fabs,fatal,,fabs38_2_1,"Refer to the GSA IAE Federal Hierarchy","accuracy"
FABS38.2.2,"For new modifications to existing awards, we derive FundingOfficeCode from the original transaction establishing the award, when it is provided there and not provided in the new modification. For this row, we are declining to derive the FundingOfficeCode from the original transaction establishing the award because the FundingOfficeCode is either not listed in the Federal Hierarchy or not specifically designated an Assistance Funding Office. Since June 2019, the Federal Hierarchy has required that FundingOfficeCodes be flagged as either a Procurement Funding Office or an Assistance Funding Office (or both). If the code you are providing in this row is indeed accurate, please update the Federal Hierarchy to include it and flag it as an Assistance Funding Office. If it is not accurate, please correct the original award transaction to reference a valid Financial Assistance funding AAC/office code in the hierarchy.",n,fabs,warning,,fabs38_2_2,"Valid FundingOfficeCode or AAC/office code needs to be present in the Federal Hierarchy","existence"
FABS38.3,"AwardingOfficeCode must be submitted for new awards (ActionType = A) or mixed aggregate records (ActionType = E) whose ActionDate is on or after October 1, 2018, and whose CorrectionDeleteIndicator is either Blank or C.",n,fabs,fatal,,fabs38_3,"AwardingOfficeCode must be submitted for new awards after 10/1/18","completeness"
FABS38.4.1,"When provided, AwardingOfficeCode must be a valid value from the Federal Hierarchy, including being designated specifically as an Assistance Awarding Office in the hierarchy.",n,fabs,fatal,,fabs38_4_1,"Refer to the GSA IAE Federal Hierarchy","existence"
FABS38.4.2,"For new modifications to existing awards, we derive AwardingOfficeCode from the original transaction establishing the award, when it is provided there and not provided in the new modification. For this row, we are declining to derive the AwardingOfficeCode from the original transaction establishing the award because the AwardingOfficeCode is either not present in the Federal Hierarchy or not specifically designated as an Assistance Awarding Office there. If the code you are providing in this row is accurate, please update the Federal Hierarchy to include it and flag it as an Assistance Awarding Office. If it is not accurate, please correct the original award transaction to reference a valid Financial Assistance Awarding AAC/office code in the hierarchy.",n,fabs,warning,,fabs38_4_2,"Valid AwardingOfficeCode or AAC/office code needs to be present in the Federal Hierarchy","existence"
FABS39.1,"PrimaryPlaceOfPerformanceCode is a required field for aggregate and non-aggregate records (RecordType = 1 or 2), and must be in 00FORGN, 00*****, XX*****, XX**###, XX#####, XX00000, XXTS###, XX####T, or XX####R formats, where XX is a valid two-character state code, # are numerals, and 'TS' and 'R' are those letters.",n,fabs,fatal,,fabs39_1,"00FORGN, 00*****, XX*****, XX**###, XX#####, XX00000, XXTS###, XX####T, or XX####R format","completeness"
FABS39.2,"For aggregate or non-aggregate records (RecordType = 1 or 2): PrimaryPlaceOfPerformanceCode must be 00FORGN for foreign places of performance (PrimaryPlaceOfPerformanceCountryCode is not USA) and must not be 00FORGN otherwise.",n,fabs,fatal,,fabs39_2,"00FORGN if PrimaryPlaceOfPerformanceCountryCode <> USA","accuracy"
FABS39.3,"For aggregate or non-aggregate records (RecordType = 1 or 2): PrimaryPlaceofPerformanceZIP+4 must not be provided for any format of PrimaryPlaceOfPerformanceCode other than XX#####, XXTS###, XX####T, or XX####R.",n,fabs,fatal,,fabs39_3,"XX#####, XXTS###, XX####T, or XX#####R format","accuracy"
FABS39.4,"PrimaryPlaceOfPerformanceCode must be blank for PII-redacted non-aggregate records (RecordType = 3).",n,fabs,fatal,,fabs39_4,"(blank)","accuracy"
FABS40.1,"When PrimaryPlaceOfPerformanceCode is in county-wide format (XX**###), county code ### must be valid and exist in the provided state XX.",n,fabs,fatal,,fabs40_1,"valid county code","existence"
FABS40.2,"PrimaryPlaceOfPerformanceCode must be in countywide (XX**###), statewide (XX*****) or 00FORGN formats for aggregate records (RecordType = 1).",n,fabs,fatal,,fabs40_2,"XX**###, XX***** or 00FORGN","accuracy"
FABS41.1,"For PrimaryPlaceOfPerformanceCode XX#####, XXTS###, XX####T, or XX####R, where PrimaryPlaceOfPerformanceZIP+4 is ""city-wide"": city code #####, TS###, ####T, or ####R must be valid and exist in the provided state. Note that only city codes with FEATURE_CLASS of 'Census,' 'Civil,' 'Locale,' and 'Populated Place' are accepted.",n,fabs,fatal,,fabs41_1,"valid city code","existence"
FABS41.2,"For PrimaryPlaceOfPerformanceCode XX#####, XXTS###, XX####T, or XX####R, where valid 5 or 9-digit PrimaryPlaceOfPerformanceZIP+4 is provided: city code #####, TS###, ####T, or ####R should be valid and exist in the provided state, but will only trigger a warning if not.",n,fabs,warning,,fabs41_2,"valid city code","completeness"
FABS41.3,"The provided PrimaryPlaceofPerformanceZIP+4 must be in the state specified by the PrimaryPlaceOfPerformanceCode. In this specific submission row, the ZIP5 (and by extension the full ZIP+4) is not a valid ZIP code in the state in question.",n,fabs,fatal,,fabs41_3,"valid ZIP code","existence"
FABS41.4,"When provided, PrimaryPlaceofPerformanceZIP+4 must be in the format #####, #########, #####-####, or contain 'city-wide'.",n,fabs,fatal,,fabs41_4,"#####, #########, #####-####, or 'city-wide'","accuracy"
FABS41.5,"The provided PrimaryPlaceofPerformanceZIP+4 must be in the state specified by PrimaryPlaceOfPerformanceCode. In this specific submission row, the first five digits are valid and located in the correct state, but the last 4 are invalid.",n,fabs,warning,,fabs41_5,"valid ZIP+4","existence"
FABS41.6,"If PrimaryPlaceOfPerformanceCode is XX00000, PrimaryPlaceOfPerformanceZip+4 must not be 'city-wide'.",n,fabs,fatal,,fabs41_6,"<>'city-wide'","accuracy"
FABS41.7,"PrimaryPlaceOfPerformanceZip+4 must be blank for PII-redacted non-aggregate records (RecordType = 3).",n,fabs,fatal,,fabs41_7,"(blank)","accuracy"
FABS41.8,"When PrimaryPlaceOfPerformanceCode is in XX#####, XXTS###, XX####T, or XX####R format, PrimaryPlaceOfPerformanceZIP+4 must not be blank (containing either a zip code or city-wide).",n,fabs,fatal,,fabs41_8,"PrimaryPlaceOfPerformanceZIP+4 must not be blank","completeness"
FABS42.1,"PrimaryPlaceOfPerformanceForeignLocationDescription is required for foreign places of performance (PrimaryPlaceOfPerformanceCountryCode does not equal USA) for non-aggregate records (RecordType = 2).",n,fabs,fatal,,fabs42_1,"(not blank)","completeness"
FABS42.2,"PrimaryPlaceOfPerformanceForeignLocationDescription must be blank for aggregate or PII-redacted non-aggregate records (RecordType = 1 or 3). For non-aggregate records (RecordType = 2), it must be blank for domestic places of performance (PrimaryPlaceOfPerformanceCountryCode = USA).",n,fabs,fatal,,fabs42_2,"(blank)","accuracy"
FABS43.1,"For foreign places of performance (PrimaryPlaceOfPerformanceCountryCode is not USA), PrimaryPlaceOfPerformanceCongressionalDistrict must be blank.",n,fabs,fatal,,fabs43_1,"(blank)","accuracy"
FABS43.2,"For aggregate and non-aggregate records (RecordType = 1 or 2), with domestic place of performance (PrimaryPlaceOfPerformanceCountryCode = USA): If 9-digit PrimaryPlaceOfPerformanceZIP+4 is not provided, PrimaryPlaceOfPerformanceCongressionalDistrict must be provided.",n,fabs,fatal,,fabs43_2,"(not blank)","completeness"
FABS43.3,"PrimaryPlaceOfPerformanceCongressionalDistrict must be blank for PII-redacted non-aggregate records (RecordType = 3).",n,fabs,fatal,,fabs43_3,"(blank)","accuracy"
FABS43.4,"If PrimaryPlaceOfPerformanceCongressionalDistrict is provided, it must be valid in the state or territory indicated by the PrimaryPlaceOfPerformanceCode. Districts that were created under the 2000 census or later are considered valid for purposes of this rule.",n,fabs,fatal,,fabs43_4,"valid congressional district","existence"
FABS44.1,"For foreign recipients (LegalEntityCountryCode is not USA), LegalEntityCongressionalDistrict must be blank.",n,fabs,fatal,,fabs44_1,"(blank)","accuracy"
FABS44.2,"For non-aggregate and PII-redacted non-aggregate records (RecordType = 2 or 3) with domestic recipients (LegalEntityCountryCode = USA): If LegalEntityZIPLast4 is not provided and LegalEntityZIP5 is, LegalEntityCongressionalDistrict must be provided.",n,fabs,fatal,,fabs44_2,"valid congressional district","completeness"
FABS44.3,"If LegalEntityCongressionalDistrict is provided, it must be valid in the state or territory indicated by LegalEntityZIP5. Districts that were created under the 2000 census or later are considered valid for purposes of this rule.",n,fabs,fatal,,fabs44_3,"valid congressional district","existence"
FABS44.4,"LegalEntityCongressionalDistrict must be blank for aggregate records (RecordType = 1).",n,fabs,fatal,,fabs44_4,"(blank)","accuracy"
FABS45,"When both IndirectCostFederalShareAmount and FederalActionObligation are provided, either 1) both should be zero; or 2) both should share the same sign and IndirectCostFederalShareAmount should be less than or equal to FederalActionObligation (in absolute value terms). For purposes of #2, $0 will be considered to have both a positive and negative sign.",n,fabs,warning,,fabs45,"IndirectCostFederalShareAmount must be less than FederalActionObligation","accuracy"
FABS46.1,"IndirectCostFederalShareAmount must be blank for non-grants/non-cooperative agreements (AssistanceType = 06, 07, 08, 09, 10, or 11).",n,fabs,warning,,fabs46_1,"(blank)","completeness"
FABS46.2,"IndirectCostFederalShareAmount is required for grants and cooperative agreements (AssistanceType = 02, 03, 04, or 05). This only applies to award actions with ActionDate on or after April 4, 2022.",n,fabs,fatal,,fabs46_2,"(not blank)","completeness"
FABS47,"FundingOpportunityNumber must be blank for non-grants/non-cooperative agreements (AssistanceType = 06, 07, 08, 09, 10, or 11).",n,fabs,fatal,,fabs47,"(blank)","accuracy"
FABS48,"FundingOpportunityGoalsText must be blank for non-grants/non-cooperative agreements (AssistanceType = 06, 07, 08, 09, 10, or 11).",n,fabs,fatal,,fabs48,"(blank)","accuracy"
FABS49,"A submitted Financial Assistance award must have a (derived) AwardingAgencyCode that is consistent with the toptier component of the agency selected at the outset of the FABS submission. This comparison only takes place at the TopTier level, not the SubTier level.",n,fabs,fatal,,fabs49,"(See SQL file)","accuracy"
FABSREQ1,"AwardDescription is required for all submissions except delete records, but was not provided in this row.",n,fabs,fatal,,fabsreq1,"Award description must not be blank","completeness"
FABSREQ3,"RecordType is required for all submissions except delete records, but was not provided in this row.",n,fabs,fatal,,fabsreq3,"RecordType must not be blank","completeness"
FABSREQ4,"BusinessFundsIndicator is required for all submissions except delete records, but was not provided in this row.",n,fabs,fatal,,fabsreq4,"BusinessFundsIndicator must not be blank","completeness"
FABSREQ5,"LegalEntityCountryCode is required for all submissions except delete records, but was not provided in this row.",n,fabs,fatal,,fabsreq5,"LegalEntityCountryCode must not be blank","completeness"
FABSREQ6,"BusinessTypes is required for all submissions except delete records, but was not provided in this row.",n,fabs,fatal,,fabsreq6,"BusinessTypes must not be blank","completeness"
FABSREQ7,"AssistanceType is required for all submissions except delete records, but was not provided in this row.",n,fabs,fatal,,fabsreq7,"AssistanceType must not be blank","completeness"
FABSREQ8,"ActionDate is required for all submissions except delete records, but was not provided in this row.",n,fabs,fatal,,fabsreq8,"ActionDate must not be blank","completeness"
FABSREQ9,"AwardeeOrRecipientLegalEntityName is required for all submissions except delete records, but was not provided in this row.",n,fabs,fatal,,fabsreq9,"AwardeeOrRecipientLegalEntityName must not be blank","completeness"
FABSREQ11,"ActionType is required for all submissions except delete records, but was not provided in this row.",n,fabs,fatal,,fabsreq11,"ActionType must not be blank","completeness"
