rule_label,rule_error_message,rule_cross_file_flag,file_type,severity_name,target_file,query_name,expected_value,category
FABS38.2.1,"When provided, FundingOfficeCode must be a valid value from the Federal Hierarchy, including being designated specifically as a Funding Office in the hierarchy.",n,fabs,fatal,,fabs38_detached_award_financial_assistance_2_1,"Refer to the GSA IAE Federal Hierarchy","accuracy"
FABS38.2.2,"For new modifications to existing awards, we derive FundingOfficeCode from the original transaction establishing the award, when it is provided there and not provided in the new modification. For this row, we are declining to derive the FundingOfficeCode from the original transaction establishing the award because the FundingOfficeCode is not present in the Federal Hierarchy. If the code is accurate, please update the Federal Hierarchy to include it. If it is not accurate, please correct the original award transaction to reference a valid Funding AAC/office code in the hierarchy. This validation rule does not apply to delete records (CorrectionDeleteIndicator = D).",n,fabs,warning,,fabs38_detached_award_financial_assistance_2_2,"Valid FundingOfficeCode or AAC/office code needs to be present in the Federal Hierarchy","existence"
FABS38.3,"AwardingOfficeCode must be submitted for new awards (ActionType = A) or mixed aggregate records (ActionType = E) whose ActionDate is on or after October 1, 2018, and whose CorrectionDeleteIndicator is either Blank or C.",n,fabs,fatal,,fabs38_detached_award_financial_assistance_3,"AwardingOfficeCode must be submitted for new awards after 10/1/18","completeness"
FABS38.4.1,"When provided, AwardingOfficeCode must be a valid value from the Federal Hierarchy, including being designated specifically as an Assistance/Grant Office in the hierarchy.",n,fabs,fatal,,fabs38_detached_award_financial_assistance_4_1,"Refer to the GSA IAE Federal Hierarchy","existence"
FABS38.4.2,"For new modifications to existing awards, we derive AwardingOfficeCode from the original transaction establishing the award, when it is provided there and not provided in the new modification. For this row, we are declining to derive the AwardingOfficeCode from the original transaction establishing the award because the AwardingOfficeCode is not present in the Federal Hierarchy. If the code is accurate, please update the Federal Hierarchy to include it. If it is not accurate, please correct the original award transaction to reference a valid Financial Assistance AAC/office code in the hierarchy. This validation rule does not apply to delete records (CorrectionDeleteIndicator = D).",n,fabs,warning,,fabs38_detached_award_financial_assistance_4_2,"Valid AwardingOfficeCode or AAC/office code needs to be present in the Federal Hierarchy","existence"
FABS39.1,"PrimaryPlaceOfPerformanceCode is a required field for aggregate and non-aggregate records (RecordType = 1 or 2), and must be in 00FORGN, 00*****, XX*****, XX**###, XX#####, or XX####R formats, where XX is a valid two-character state code, # are numerals, and 'R' is that letter.",n,fabs,fatal,,fabs39_detached_award_financial_assistance_1,"00FORGN, 00*****, XX*****, XX**###, XX#####, XX00000, or XX####R format","completeness"
FABS39.2,"For aggregate or non-aggregate records (RecordType = 1 or 2): PrimaryPlaceOfPerformanceCode must be 00FORGN for foreign places of performance (PrimaryPlaceOfPerformanceCountryCode is not USA) and must not be 00FORGN otherwise.",n,fabs,fatal,,fabs39_detached_award_financial_assistance_2,"00FORGN if PrimaryPlaceOfPerformanceCountryCode <> USA","accuracy"
FABS39.3,"For aggregate or non-aggregate records (RecordType = 1 or 2): PrimaryPlaceofPerformanceZIP+4 must not be provided for any format of PrimaryPlaceOfPerformanceCode other than XX##### or XX####R.",n,fabs,fatal,,fabs39_detached_award_financial_assistance_3,"XX##### or XX#####R format","accuracy"
FABS39.4,"PrimaryPlaceOfPerformanceCode must be blank for PII-redacted non-aggregate records (RecordType = 3).",n,fabs,fatal,,fabs39_detached_award_financial_assistance_4,"(blank)","accuracy"
FABS40.1,"When PrimaryPlaceOfPerformanceCode is in county-wide format (XX**###), county code ### must be valid and exist in the provided state XX.",n,fabs,fatal,,fabs40_detached_award_financial_assistance_1,"valid county code","existence"
FABS40.2,"PrimaryPlaceOfPerformanceCode must be in countywide (XX**###), statewide (XX*****) or 00FORGN formats for aggregate records (RecordType = 1).",n,fabs,fatal,,fabs40_detached_award_financial_assistance_2,"XX**###, XX***** or 00FORGN","accuracy"
FABS41.1,"For PrimaryPlaceOfPerformanceCode XX##### or XX####R, where PrimaryPlaceOfPerformanceZIP+4 is blank or ""city-wide"": city code ##### or ####R must be valid and exist in the provided state.",n,fabs,fatal,,fabs41_detached_award_financial_assistance_1,"valid city code","existence"
FABS41.2,"For PrimaryPlaceOfPerformanceCode XX##### or XX####R, where valid 5 or 9-digit PrimaryPlaceOfPerformanceZIP+4 is provided : city code ##### or ####R should be valid and exist in the provided state, but will only trigger a warning if not.",n,fabs,warning,,fabs41_detached_award_financial_assistance_2,"valid city code","completeness"
FABS41.3,"The provided PrimaryPlaceofPerformanceZIP+4 must be in the state specified by the PrimaryPlaceOfPerformanceCode. In this specific submission row, the ZIP5 (and by extension the full ZIP+4) is not a valid ZIP code in the state in question.",n,fabs,fatal,,fabs41_detached_award_financial_assistance_3,"valid ZIP code","existence"
FABS41.4,"When provided, PrimaryPlaceofPerformanceZIP+4 must be in the format #####, #########, #####-####, or contain 'city-wide'.",n,fabs,fatal,,fabs41_detached_award_financial_assistance_4,"#####, #########, #####-####, or 'city-wide'","accuracy"
FABS41.5,"The provided PrimaryPlaceofPerformanceZIP+4 must be in the state specified by PrimaryPlaceOfPerformanceCode. In this specific submission row, the first five digits are valid and located in the correct state, but the last 4 are invalid.",n,fabs,warning,,fabs41_detached_award_financial_assistance_5,"valid ZIP+4","existence"
FABS41.6,"If PrimaryPlaceOfPerformanceCode is XX00000, PrimaryPlaceOfPerformanceZip+4 must not be 'city-wide'.",n,fabs,fatal,,fabs41_detached_award_financial_assistance_6,"<>'city-wide'","accuracy"
FABS41.7,"PrimaryPlaceOfPerformanceZip+4 must be blank for PII-redacted non-aggregate records (RecordType = 3).",n,fabs,fatal,,fabs41_detached_award_financial_assistance_7,"(blank)","accuracy"
FABS42.1,"PrimaryPlaceOfPerformanceForeignLocationDescription is required for foreign places of performance (PrimaryPlaceOfPerformanceCountryCode does not equal USA) for non-aggregate records (RecordType = 2).",n,fabs,fatal,,fabs42_detached_award_financial_assistance_1,"(not blank)","completeness"
FABS42.2,"PrimaryPlaceOfPerformanceForeignLocationDescription must be blank for aggregate or PII-redacted non-aggregate records (RecordType = 1 or 3). For non-aggregate records (RecordType = 2), it must be blank for domestic places of performance (PrimaryPlaceOfPerformanceCountryCode = USA).",n,fabs,fatal,,fabs42_detached_award_financial_assistance_2,"(blank)","accuracy"
FABS43.1,"For foreign places of performance (PrimaryPlaceOfPerformanceCountryCode is not USA), PrimaryPlaceOfPerformanceCongressionalDistrict must be blank.",n,fabs,fatal,,fabs43_detached_award_financial_assistance_1,"(blank)","accuracy"
FABS43.2,"For aggregate and non-aggregate records (RecordType = 1 or 2) with domestic place of performance (PrimaryPlaceOfPerformanceCountryCode = USA): If PrimaryPlaceOfPerformanceZIP+4 is 5-digits or blank, a PrimaryPlaceOfPerformanceCongressionalDistrict must be provided.",n,fabs,fatal,,fabs43_detached_award_financial_assistance_2,"(not blank)","completeness"
FABS43.3,"PrimaryPlaceOfPerformanceCongressionalDistrict must be blank for PII-redacted non-aggregate records (RecordType = 3).",n,fabs,fatal,,fabs43_detached_award_financial_assistance_3,"(blank)","accuracy"
FABS43.4,"If PrimaryPlaceOfPerformanceCongressionalDistrict is provided, it must be valid in the state or territory indicated by the PrimaryPlaceOfPerformanceCode. Districts that were created under the 2000 census or later are considered valid for purposes of this rule.",n,fabs,fatal,,fabs43_detached_award_financial_assistance_4,"valid congressional district","existence"
FABS44.1,"For foreign recipients (LegalEntityCountryCode is not USA), LegalEntityCongressionalDistrict must be blank.",n,fabs,fatal,,fabs44_detached_award_financial_assistance_1,"(blank)","accuracy"
FABS44.2,"For non-aggregate and PII-redacted non-aggregate records (RecordType = 2 or 3) with domestic recipients (LegalEntityCountryCode = USA): If LegalEntityZIPLast4 is not provided and LegalEntityZIP5 is, LegalEntityCongressionalDistrict must be provided.",n,fabs,fatal,,fabs44_detached_award_financial_assistance_2,"valid congressional district","completeness"
FABS44.3,"If LegalEntityCongressionalDistrict is provided, it must be valid in the state or territory indicated by LegalEntityZIP5. Districts that were created under the 2000 census or later are considered valid for purposes of this rule.",n,fabs,fatal,,fabs44_detached_award_financial_assistance_3,"valid congressional district","existence"
FABS44.4,"LegalEntityCongressionalDistrict must be blank for aggregate records (RecordType = 1).",n,fabs,fatal,,fabs44_detached_award_financial_assistance_4,"(blank)","accuracy"
FABSREQ1,"AwardDescription is required for all submissions except delete records, but was not provided in this row.",n,fabs,fatal,,fabsreq1_detached_award_financial_assistance,"Award description must not be blank","completeness"
FABSREQ3,"RecordType is required for all submissions except delete records, but was not provided in this row.",n,fabs,fatal,,fabsreq3_detached_award_financial_assistance,"RecordType must not be blank","completeness"
FABSREQ4,"BusinessFundsIndicator is required for all submissions except delete records, but was not provided in this row.",n,fabs,fatal,,fabsreq4_detached_award_financial_assistance,"BusinessFundsIndicator must not be blank","completeness"
FABSREQ5,"LegalEntityCountryCode is required for all submissions except delete records, but was not provided in this row.",n,fabs,fatal,,fabsreq5_detached_award_financial_assistance,"LegalEntityCountryCode must not be blank","completeness"
FABSREQ6,"BusinessTypes is required for all submissions except delete records, but was not provided in this row.",n,fabs,fatal,,fabsreq6_detached_award_financial_assistance,"BusinessTypes must not be blank","completeness"
FABSREQ7,"AssistanceType is required for all submissions except delete records, but was not provided in this row.",n,fabs,fatal,,fabsreq7_detached_award_financial_assistance,"AssistanceType must not be blank","completeness"
FABSREQ8,"ActionDate is required for all submissions except delete records, but was not provided in this row.",n,fabs,fatal,,fabsreq8_detached_award_financial_assistance,"ActionDate must not be blank","completeness"
FABSREQ9,"AwardeeOrRecipientLegalEntityName is required for all submissions except delete records, but was not provided in this row.",n,fabs,fatal,,fabsreq9_detached_award_financial_assistance,"AwardeeOrRecipientLegalEntityName must not be blank","completeness"
FABSREQ11,"ActionType is required for all submissions except delete records, but was not provided in this row.",n,fabs,fatal,,fabsreq11_detached_award_financial_assistance,"ActionType must not be blank","completeness"
