rule_label,rule_error_message,rule_cross_file_flag,file_type,severity_name,target_file,query_name,expected_value,category
C7.1,"GrossOutlaysDeliveredOrdersPaidTotalCPE = USSGL(4902 + 4908 + 4982). This applies to the award level.",n,award_financial,warning,,c7_award_financial_1,"Within File C, GrossOutlaysDeliveredOrdersPaidTotal_CPE should equal USSGL 4902_CPE + 4908_CPE + 4982_CPE. However, the Broker cannot determine which element is incorrect in this rule. Refer to your source information to distinguish which elements may be incorrect.","accuracy"
C7.2,"GrossOutlaysDeliveredOrdersPaidTotalFYB = USSGL4908. This applies to the award level.",n,award_financial,warning,,c7_award_financial_2,"Within File C, GrossOutlaysDeliveredOrdersPaidTotal_FYB should equal USSGL 4908_FYB. However, the Broker cannot determine which element is incorrect in this rule. Refer to your source information to distinguish which elements may be incorrect.","accuracy"
C8,"Unique FAIN/URI from file C should exist in file D2. FAIN may be null for aggregate records. URI may be null for non-aggregate and PII-redacted non-aggregate records.",y,award_financial,warning,award,c8_award_financial,"(See SQL file)","completeness"
C9,"Unique FAIN and/or URI from file D2 should exist in file C, except for: 1) Loans (AssistanceType = 07 or 08) with OriginalLoanSubsidyCost <= 0 in D2; or 2) Non-Loans with FederalActionObligation = 0 in D2. FAIN may be null for aggregate records. URI may be null for non-aggregate and PII-redacted non-aggregate records.",y,award,warning,award_financial,c9_award_financial,"(See SQL file)","completeness"
C11,"Each unique PIID (or combination of PIID/ParentAwardId) from file C should exist in file D1.",y,award_financial,warning,award_procurement,c11_cross_file,"(See SQL file)","completeness"
C12,"Each unique PIID (or combination of PIID/ParentAwardId) from file D1 should exist in file C during the same reporting period, except D1 records where FederalActionObligation = 0.",y,award_procurement,warning,award_financial,c12_cross_file,"(See SQL file)","completeness"
C14.1,"Must provide either FAIN, URI, or PIID",n,award_financial,fatal,,c14_award_financial_1,"Each row provided in file C must contain either a FAIN, URI, or PIID. Rows must not contain a PIID and FAIN, or a PIID and URI.","completeness"
C14.2,"PIID may not be provided if FAIN or URI are present",n,award_financial,fatal,,c14_award_financial_2,"Each row provided in file C must contain either a FAIN, URI, or PIID. Rows must not contain a PIID and FAIN, or a PIID and URI.","existence"
C17,"TransactionObligatedAmount required on rows that do not include values for USSGL accounts balances or subtotals",n,award_financial,warning,,c17_award_financial,"The value for TransactionObligatedAmount should be blank on this row since it contains values for USSGL related elements.","completeness"
C18,"DeobligationsRecoveriesRefundsOfPriorYearByAward_CPE = USSGL(4871+ 4872 + 4971 + 4972). This applies to the award level.",n,award_financial,warning,,c18_award_financial,"Within File C, DeobligationsRecoveriesRefundsOfPriorYearByProgramObjectClass_CPE should equal the amounts provided in File C for USSGL(4871_CPE+ 4872_CPE + 4971_CPE + 4972_CPE). The Broker cannot distinguish which element is correct for this rule; the agency should review its source information.","accuracy"
C20,"The totals by combination of TAS/object class provided in File C must be a subset of, or equal to, the same combinations in File B.",y,award_financial,warning,program_activity,c20_award_financial,"(See SQL file)","existence"
C21,"The totals by combination of TAS/program activity code provided in File C must be a subset of, or equal to, the same combinations in File B.",y,award_financial,warning,program_activity,c21_award_financial,"(See SQL file)","existence"
C23.1,"For each unique PIID in File C, the sum of each TransactionObligatedAmount should match (but with opposite signs) the sum of the FederalActionObligation reported in D1. This rule does not apply if the ATA field is populated and is different from the Agency ID.",y,award_financial,warning,award_procurement,c23_award_financial_1,"(See SQL file)","accuracy"
C23.2,"For each unique combination of PIID/ParentAwardId in File C, the sum of each TransactionObligatedAmount should match (but with opposite signs) the sum of the FederalActionObligation reported in D1. This rule does not apply if the ATA field is populated and is different from the Agency ID.",y,award_financial,warning,award_procurement,c23_award_financial_2,"(See SQL file)","accuracy"
C23.3,"For each unique FAIN in File C, the sum of each TransactionObligatedAmount should match (but with opposite signs) the sum of the FederalActionObligation or OriginalLoanSubsidyCost amounts reported in D2. This rule does not apply if the ATA field is populated and is different from the Agency ID.",y,award_financial,warning,award,c23_award_financial_3,"(See SQL file)","accuracy"
C23.4,"For each unique URI in File C, the sum of each TransactionObligatedAmount should match (but with opposite signs) the sum of the FederalActionObligation or OriginalLoanSubsidyCost amounts reported in D2. This rule does not apply if the ATA field is populated and is different from the Agency ID.",y,award_financial,warning,award,c23_award_financial_4,"(See SQL file)","accuracy"
FABS1,"FAIN is required for non-aggregate and PII-redacted non-aggregate records (RecordType = 2 or 3).",n,fabs,fatal,,fabs1_detached_award_financial_assistance,"FAIN is required for this RecordType.","completeness"
FABS2.1,"The combination of FAIN, AwardModificationAmendmentNumber, URI, CFDA_Number, and AwardingSubTierAgencyCode must be unique within the submission file.",n,fabs,fatal,,fabs2_detached_award_financial_assistance_1,"The combination of FAIN, AwardModificationAmendmentNumber, URI, CFDA_Number, and AwardingSubTierAgencyCode must be unique for each row within the submission file.","existence"
FABS2.2.1,"The combination of FAIN, AwardModificationAmendmentNumber, URI, CFDA_Number, and AwardingSubTierAgencyCode must be unique when compared to currently published data--unless the record is a correction or deletion (i.e., if CorrectionDeleteIndicator = C or D). In this particular case, the combination of these five fields in this transaction has already been published in USAspending, making this second attempt a duplicate.",n,fabs,fatal,,fabs2_detached_award_financial_assistance_2_1,"The combination of FAIN, AwardModificationAmendmentNumber, URI, CFDA_Number, and AwardingSubTierAgencyCode must be unique when compared to currently published data.","existence"
FABS2.2.2,"The unique combination of FAIN, AwardModificationAmendmentNumber, URI, CFDA_Number, and AwardingSubTierAgencyCode must exist as a currently published record when the record is a correction (i.e., if CorrectionDeleteIndicator = C).",n,fabs,fatal,,fabs2_detached_award_financial_assistance_2_2,"The combination of FAIN, AwardModificationAmendmentNumber, URI, CFDA_Number, and AwardingSubTierAgencyCode must be unique when compared to currently published data.","existence"
FABS2.2.3,"The unique combination of FAIN, AwardModificationAmendmentNumber, URI, CFDA_Number, and AwardingSubTierAgencyCode must exist as a currently published record when the record is a deletion (i.e., if CorrectionDeleteIndicator = D).",n,fabs,fatal,,fabs2_detached_award_financial_assistance_2_3,"The combination of FAIN, AwardModificationAmendmentNumber, URI, CFDA_Number, and AwardingSubTierAgencyCode must be unique when compared to currently published data.","existence"
FABS3.2,"ActionType should contain one of the following values: ""A"", ""B"", ""C"", ""D"", or ""E"".",n,fabs,fatal,,fabs3_detached_award_financial_assistance_2,"A, B, C, D, or E","completeness"
FABS3.3,"ActionType should be B, C, or D for transactions that modify existing awards. For aggregate (RecordType = 1) record transactions, we consider a record a modification if its combination of URI + AwardingSubTierAgencyCode matches an existing published FABS record of the same RecordType. For non-aggregate (RecordType = 2 or 3) record transactions, we consider a record a modification if its combination of RecordType + FAIN + AwardingSubTierCode matches an existing published FABS record of the same RecordType. This validation rule does not apply to delete records (CorrectionDeleteIndicator = D.).",n,fabs,warning,,fabs3_detached_award_financial_assistance_3,"B, C, or D","existence"
FABS3.4,"ActionType = E is only valid for mixed aggregate records (RecordType = 1.)",n,fabs,fatal,,fabs3_detached_award_financial_assistance_4,"RecordType = 1 when ActionType = E","accuracy"
FABS3.5,"ActionType should be ""A"" for the initial transaction of a new, non-aggregate award (RecordType = 2 or 3) and ""A"" or ""E"" for a new aggregate award (RecordType = 1). An aggregate record transaction is considered the initial transaction of a new award if it contains a unique combination of URI + AwardingSubTierAgencyCode when compared to currently published FABS data of the same RecordType. A non-aggregate record transaction is considered the initial transaction of a new award if it contains a unique combination of FAIN + AwardingSubTierAgencyCode when compared to currently published FABS data of the same RecordType. This validation rule does not apply to delete records (CorrectionDeleteIndicator = D.)",n,fabs,warning,,fabs3_detached_award_financial_assistance_5,"A for aggregate, A or E for non-aggregate","accuracy"
FABS4.1,"ActionDate must follow YYYYMMDD format, where YYYY is the year, MM the month and DD the day.",n,fabs,fatal,,fabs4_detached_award_financial_assistance_1,"ActionDate must follow YYYYMMDD format","accuracy"
FABS4.2,"Value of ActionDate must be between 19991001 and 20991231 (i.e., a date between 10/01/1999 and 12/31/2099).",n,fabs,fatal,,fabs4_detached_award_financial_assistance_2,"Between 10/1/1999 and 12/31/2099","accuracy"
FABS4.3,"A future ActionDate is valid only if it occurs within the current fiscal year",n,fabs,fatal,,fabs4_detached_award_financial_assistance_3,"Less than or equal to September 30 of the current fiscal year","accuracy"
FABS5,"AssistanceType field must contain one of the following values: ""02"", ""03"", ""04"", ""05"", ""06"", ""07"", ""08"", ""09"", ""10"", or ""11"".",n,fabs,fatal,,fabs5_detached_award_financial_assistance,"""02,"" ""03"", ""04"", ""05"", ""06"", ""07"", ""08"", ""09"", ""10"", or ""11"".","accuracy"
FABS6,"RecordType field must contain one of the following values: ""1"", ""2"", or ""3"".",n,fabs,fatal,,fabs6_detached_award_financial_assistance,"""1,"" ""2"" or ""3"".","accuracy"
FABS7,"URI is a required field for aggregate records (RecordType = 1).",n,fabs,fatal,,fabs7_detached_award_financial_assistance,"URI is required for this RecordType","completeness"
FABS9.1,"AwardeeOrRecipientLegalEntityName must contain ""MULTIPLE RECIPIENTS"" for aggregate records (RecordType = 1).",n,fabs,fatal,,fabs9_detached_award_financial_assistance_1,"MULTIPLE RECIPIENTS","accuracy"
FABS9.2,"AwardeeOrRecipientLegalEntityName must contain ""REDACTED DUE TO PII"" for PII-redacted non-aggregate records (RecordType = 3).",n,fabs,fatal,,fabs9_detached_award_financial_assistance_2,"REDACTED DUE TO PII","accuracy"
FABS10.1,"LegalEntityAddressLine1 is required for non-aggregate records (RecordType = 2).",n,fabs,fatal,,fabs10_detached_award_financial_assistance_1,"LegalEntityAddressLine1 is required for this RecordType.","completeness"
FABS10.2,"LegalEntityAddressLine1 must be blank for aggregate and PII-redacted non-aggregate records (RecordType = 1 or 3).",n,fabs,fatal,,fabs10_detached_award_financial_assistance_2,"(blank)","accuracy"
FABS11,"LegalEntityAddressLine2 is optional, but must be blank for aggregate and PII-redacted non-aggregate records (RecordType = 1 or 3).",n,fabs,fatal,,fabs11_detached_award_financial_assistance,"(blank) for RecordType 1 or 3","accuracy"
FABS13.1,"LegalEntityZIP5 must be blank for aggregate records (RecordType = 1).",n,fabs,fatal,,fabs13_detached_award_financial_assistance_1,"(blank) for RecordType 1","accuracy"
FABS13.2,"LegalEntityZIP5 must be blank for foreign recipients (i.e., when LegalEntityCountryCode is not USA).",n,fabs,fatal,,fabs13_detached_award_financial_assistance_2,"(blank)","accuracy"
FABS13.3,"LegalEntityZIP5 is required for domestic recipients (LegalEntityCountryCode = USA) for non-aggregate and PII-redacted non-aggregate records (RecordType = 2 or 3).",n,fabs,fatal,,fabs13_detached_award_financial_assistance_3,"LegalEntityZIP5 is required for this domestic record type.","completeness"
FABS14.1,"LegalEntityZIPLast4 must be blank for aggregate and PII-redacted non-aggregate records (RecordType = 1 or 3).",n,fabs,fatal,,fabs14_detached_award_financial_assistance_1,"(blank) for RecordType 1 or 3","accuracy"
FABS14.2,"LegalEntityZIPLast4 must be blank for foreign recipients (i.e., when LegalEntityCountryCode is not USA).",n,fabs,fatal,,fabs14_detached_award_financial_assistance_2,"(blank)","accuracy"
FABS14.3,"When it exists, LegalEntityZIPLast4 should be provided for domestic recipients (LegalEntityCountryCode = USA) for non-aggregate records (RecordType = 2).",n,fabs,warning,,fabs14_detached_award_financial_assistance_3,"LegalEntityZIPLast4 should be provided for this domestic record type.","completeness"
FABS15.1,"LegalEntityForeignCityName is required for foreign recipients (i.e., when LegalEntityCountryCode is not USA) for non-aggregate and PII-redacted non-aggregate records (RecordType = 2 or 3).",n,fabs,fatal,,fabs15_detached_award_financial_assistance_1,"LegalEntityForeignCityName is required for this record type.","completeness"
FABS15.2,"LegalEntityForeignCityName must be blank for domestic recipients (LegalEntityCountryCode = USA) and for aggregate records (RecordType = 1).",n,fabs,fatal,,fabs15_detached_award_financial_assistance_2,"(blank)","accuracy"
FABS16,"LegalEntityForeignProvinceName must be blank for domestic recipients (LegalEntityCountryCode = USA) and for aggregate records (RecordType = 1).",n,fabs,fatal,,fabs16_detached_award_financial_assistance,"(blank)","accuracy"
FABS17,"LegalEntityForeignPostalCode must be blank for domestic recipients (LegalEntityCountryCode = USA) and for aggregate records (RecordType = 1).",n,fabs,fatal,,fabs17_detached_award_financial_assistance,"(blank)","accuracy"
FABS18,"BusinessTypes must be one to three letters in length. BusinessTypes values must be non-repeated letters from A to X.",n,fabs,fatal,,fabs18_detached_award_financial_assistance,"BusinessTypes values must be non-repeated letters from A to X.","accuracy"
FABS19,"LegalEntityCountryCode must contain a valid three character GENC country code. U.S. Territories and Freely Associated States must be submitted with country code = USA and their state/territory code; they cannot be submitted with their GENC country code. For a list of these territories and more information, see Appendix B of the DAIMS Practices and Procedures.",n,fabs,fatal,,fabs19_detached_award_financial_assistance,"The authoritative source for these codes is the GENC Standard Version 3, Update 4.","completeness"
FABS21.1,"When provided, FundingSubTierAgencyCode must be a valid 4-character sub-tier agency code from the Federal Hierarchy.",n,fabs,fatal,,fabs21_detached_award_financial_assistance_1,"Refer to the GSA IAE Federal Hierarchy","accuracy"
FABS21.2,"If both are submitted, FundingSubTierAgencyCode and FundingOfficeCode must belong to the same FundingAgencyCode (per the Federal Hierarchy).",n,fabs,fatal,,fabs21_detached_award_financial_assistance_2,"Refer to the GSA IAE Federal Hierarchy","accuracy"
FABS22,"When provided, CorrectionDeleteIndicator must contain one of the following values: ""C"" or ""D"".",n,fabs,fatal,,fabs22_detached_award_financial_assistance,"(blank), C, or D","accuracy"
FABS23.1,"When provided, AwardingSubTierAgencyCode must be a valid 4-character sub-tier agency code from the Federal Hierarchy.",n,fabs,fatal,,fabs23_detached_award_financial_assistance_1,"Refer to the GSA IAE Federal Hierarchy","accuracy"
FABS23.2,"If both are submitted, AwardingSubTierAgencyCode and AwardingOfficeCode must belong to the same AwardingAgencyCode (per the Federal Hierarchy).",n,fabs,fatal,,fabs23_detached_award_financial_assistance_2,"Refer to the GSA IAE Federal Hierarchy","accuracy"
FABS23.3,"AwardingSubTierAgencyCode must be provided when AwardingOfficeCode is not provided.",n,fabs,fatal,,fabs23_detached_award_financial_assistance_3,"non-blank AwardingSubTierAgencyCode or AwardingOfficeCode","accuracy"
FABS24.1,"PrimaryPlaceOfPerformanceCountryCode must be blank for PII-redacted non-aggregate records (RecordType = 3).",n,fabs,fatal,,fabs24_detached_award_financial_assistance_1,"(blank)","accuracy"
FABS24.2,"PrimaryPlaceOfPerformanceCountryCode must contain a valid three character GENC country code for aggregate or non-aggregate records (RecordType = 1 or 2). U.S. Territories and Freely Associated States must be submitted with country code = USA and their state/territory code; they cannot be submitted with their GENC country code. For a list of these territories and more information, see Appendix B of the DAIMS Practices and Procedures.",n,fabs,fatal,,fabs24_detached_award_financial_assistance_2,"The authoritative source for these codes is the GENC Standard Version 3, Update 4.","completeness"
FABS26.1,"FederalActionObligation must be blank or 0 for loans (AssistanceType = 07 or 08).",n,fabs,fatal,,fabs26_detached_award_financial_assistance_1,"(blank) or 0","accuracy"
FABS26.2,"FederalActionObligation is required for non-loans (i.e., when AssistanceType is not 07 or 08).",n,fabs,fatal,,fabs26_detached_award_financial_assistance_2,"<>0","completeness"
FABS27,"NonFederalFundingAmount must be blank or 0 for loans (AssistanceType = 07 or 08).",n,fabs,fatal,,fabs27_detached_award_financial_assistance,"(blank) or 0","accuracy"
FABS28.1,"FaceValueOfDirectLoanOrLoanGuarantee is required for loans (AssistanceType = 07 or 08).",n,fabs,fatal,,fabs28_detached_award_financial_assistance_1,"<>0","completeness"
FABS28.2,"FaceValueOfDirectLoanOrLoanGuarantee must be blank or 0 for non-loans (i.e., when AssistanceType is not 07 or 08).",n,fabs,fatal,,fabs28_detached_award_financial_assistance_2,"(blank) or 0","accuracy"
FABS29.1,"OriginalLoanSubsidyCost is required for loans (AssistanceType = 07 or 08).",n,fabs,fatal,,fabs29_detached_award_financial_assistance_1,"<>0","completeness"
FABS29.2,"OriginalLoanSubsidyCost must be blank or 0 for non-loans (i.e., when AssistanceType is not 07 or 08).",n,fabs,fatal,,fabs29_detached_award_financial_assistance_2,"(blank) or 0","accuracy"
FABS30,"BusinessFundsIndicator must contain one of the following values: ""REC"" or ""NON"".",n,fabs,fatal,,fabs30_detached_award_financial_assistance,"""REC"" or ""NON""","completeness"
FABS31.1,"AwardeeOrRecipientUniqueIdentifier Field must be blank for aggregate and PII-redacted non-aggregate records (RecordType = 1 or 3, regardless of the BusinessTypes value) and individual recipients (BusinessTypes includes 'P', regardless of the RecordType value).",n,fabs,fatal,,fabs31_detached_award_financial_assistance_1,"(blank)","accuracy"
FABS31.2,"AwardeeOrRecipientUniqueIdentifier is required for AssistanceType of 02, 03, 04, or 05 where ActionDate is after October 1, 2010, unless the record is an aggregate or PII-redacted non-aggregate record (RecordType = 1 or 3) or individual recipient (BusinessTypes includes 'P').",n,fabs,fatal,,fabs31_detached_award_financial_assistance_2,"AwardeeOrRecipientUniqueIdentifier is required.","completeness"
FABS31.3,"When AwardeeOrRecipientUniqueIdentifier is provided, it must be nine digits.",n,fabs,fatal,,fabs31_detached_award_financial_assistance_3,"AwardeeOrRecipientUniqueIdentifier must be 9 digits.","accuracy"
FABS31.4,"For AssistanceType of 02, 03, 04, or 05 whose ActionDate is after October 1, 2010, AwardeeOrRecipientUniqueIdentifier must be registered (not necessarily active) in SAM, unless the record is an aggregate or PII-redacted non-aggregate record (RecordType = 1 or 3) or awarded to an individual recipient (BusinessTypes includes 'P').",n,fabs,fatal,,fabs31_detached_award_financial_assistance_4,"AwardeeOrRecipientUniqueIdentifier must be registered in SAM","existence"
FABS31.5,"For AssistanceType of 02, 03, 04, or 05 whose ActionDate is after October 1, 2010 and ActionType = A, AwardeeOrRecipientUniqueIdentifier must be active as of the ActionDate, unless the record is an aggregate or PII-redacted non-aggregate record (RecordType = 1 or 3) or awarded to an individual recipient (BusinessTypes includes 'P'). This is an error because CorrectionDeleteIndicator is not C or the action date is after January 1, 2017.",n,fabs,fatal,,fabs31_detached_award_financial_assistance_5,"AwardeeOrRecipientUniqueIdentifier must be active in SAM","existence"
FABS31.6,"For AssistanceType of 02, 03, 04, or 05 whose ActionDate is after October 1, 2010 and ActionType = A, AwardeeOrRecipientUniqueIdentifier should be active as of the ActionDate, unless the record is an aggregate or PII-redacted non-aggregate record (RecordType = 1 or 3) or awarded to an individual recipient (BusinessTypes includes 'P'). This is a warning because CorrectionDeleteIndicator is C and the action date is before January 1, 2017.",n,fabs,warning,,fabs31_detached_award_financial_assistance_6,"AwardeeOrRecipientUniqueIdentifier should be active in SAM","existence"
FABS31.7,"For AssistanceType of 02, 03, 04, or 05 whose ActionDate is after October 1, 2010 and ActionType = B, C, or D, AwardeeOrRecipientUniqueIdentifier should be active on the ActionDate, unless the record is an aggregate or PII-redacted non-aggregate record (RecordType = 1 or 3) or awarded to an individual recipient (BusinessTypes includes 'P').",n,fabs,warning,,fabs31_detached_award_financial_assistance_7,"AwardeeOrRecipientUniqueIdentifier should be active in SAM","existence"
FABS32.1,"PeriodOfPerformanceStartDate is an optional field, but when provided, must follow YYYYMMDD format, where YYYY is the year, MM the month and DD the day.",n,fabs,fatal,,fabs32_detached_award_financial_assistance_1,"PeriodOfPerformanceStartDate must follow the YYYYMMDD format.","accuracy"
FABS32.2,"When provided, PeriodOfPerformanceStartDate should be a valid date between 19991001 and 20991231.",n,fabs,warning,,fabs32_detached_award_financial_assistance_2,"between 10/1/1999 and 12/31/2099","accuracy"
FABS33.1,"PeriodOfPerformanceCurrentEndDate is an optional field, but when provided, must follow YYYYMMDD format, where YYYY is the year, MM the month and DD the day.",n,fabs,fatal,,fabs33_detached_award_financial_assistance_1,"PeriodOfPerformanceCurrentEndDate must follow the YYYYMMDD format.","accuracy"
FABS33.2,"When provided, PeriodOfPerformanceCurrentEndDate must be a valid date between 19991001 and 20991231.",n,fabs,fatal,,fabs33_detached_award_financial_assistance_2,"between 10/1/1999 and 12/31/2099","accuracy"
FABS34.1,"When both are provided, PeriodOfPerformanceStartDate must occur on or before PeriodOfPerformanceCurrentEndDate.",n,fabs,fatal,,fabs34_detached_award_financial_assistance_1,"less than or equal to [PeriodOfPerformanceCurrentEndDate]","accuracy"
FABS34.2,"While they are optional fields, if either PeriodOfPerformanceCurrentEndDate or PeriodOfPerformanceStartDate is provided, both fields should be provided.",n,fabs,warning,,fabs34_detached_award_financial_assistance_2,"both or neither PeriodOfPerformanceStartDate and PeriodOfPerformanceCurrentEndDate should be provided","completeness"
FABS35.1,"When provided, LegalEntityZIPLast4 must be in the #### format.",n,fabs,fatal,,fabs35_detached_award_financial_assistance_1,"Four digits need to be provided.","accuracy"
FABS35.2,"LegalEntityZIP5 must be a valid 5-digit USPS ZIP code.",n,fabs,fatal,,fabs35_detached_award_financial_assistance_2,"The ZIP code needs to be a valid 5-digit code.","existence"
FABS35.3,"The combination of LegalEntityZIP5 and LegalEntityZIPLast4 should be a valid 9-digit USPS ZIP+4 code.",n,fabs,warning,,fabs35_detached_award_financial_assistance_3,"The ZIP+4 code needs to be a valid USPS code.","existence"
FABS36,"CFDA_Number must be in XX.XXX format, where # represents a number from 0 to 9.",n,fabs,fatal,,fabs36_detached_award_financial_assistance,"The CFDA_Number must consist of two digits, a period, and then three digits.","accuracy"
FABS37.1,"For new (ActionType = A) or mixed aggregate (ActionType = E) assistance awards specifically, the CFDA_Number must be active as of the ActionDate. This does not apply to correction records (those with CorrectionDeleteIndicator = C and delete records).",n,fabs,fatal,,fabs37_detached_award_financial_assistance_1,"The CFDA_Number must be active","existence"
FABS37.2,"For non-new assistance awards (ActionType = B, C, or D), the CFDA_Number need not be active as of the ActionDate, but a warning will trigger in this case. This warning will not trigger for correction records (those with CorrectionDeleteIndicator = C).",n,fabs,warning,,fabs37_detached_award_financial_assistance_2,"The CFDA_Number should be active","existence"
FABS37.3,"For all records, CFDA_Number must have been registered with CFDA.gov or registered as an Assistance Listing on beta.SAM.gov (post-May 2018) at some point in time. ",n,fabs,fatal,,fabs37_detached_award_financial_assistance_3,"The CFDA_Number must be registered","existence"
FABS38.1,"FundingOfficeCode must be submitted for new awards (ActionType = A) or mixed aggregate records (ActionType = E) whose ActionDate is on or after October 1, 2018, and whose CorrectionDeleteIndicator is either Blank or C.",n,fabs,fatal,,fabs38_detached_award_financial_assistance_1,"FundingOfficeCode must be submitted for new awards made after 10/1/18","completeness"
