rule_label,rule_error_message,rule_cross_file_flag,file_type,severity_name,target_file,query_name,expected_value,category
C3.2,"ObligationsUndeliveredOrdersUnpaidTotalCPE = USSGL(4801 + 4831+ 4881) for the same TAS/DEFC combination. This applies to the award level.",n,award_financial,warning,,c3_award_financial_2,"Within File C, ObligationsUndeliveredOrdersUnpaidTotal_CPE should equal USSGL4801_CPE + 4831_CPE + 4881_CPE for the same TAS/DEFC combination. However, the Broker cannot determine which element is incorrect in this rule. Refer to your source information to distinguish which elements may be incorrect.","accuracy"
C4.1,"ObligationsDeliveredOrdersUnpaidTotalFYB = USSGL4901 for the same TAS/DEFC combination. This applies to the award level.",n,award_financial,warning,,c4_award_financial_1,"Within File C, ObligationsDeliveredOrdersUnpaidTotal_FYB should equal USSGL4901_FYB for the same TAS/DEFC combination. However, the Broker cannot determine which element is incorrect in this rule. Refer to your source information to distinguish which elements may be incorrect.","accuracy"
C4.2,"ObligationsDeliveredOrdersUnpaidTotalCPE = USSGL(4901 + 4931+ 4981) for the same TAS/DEFC combination. This applies to the award level.",n,award_financial,warning,,c4_award_financial_2,"Within File C, ObligationsDeliveredOrdersUnpaidTotal_CPE should equal USSGL4901_CPE + 4931_CPE + 4981_CPE for the same TAS/DEFC combination. However, the Broker cannot determine which element is incorrect in this rule. Refer to your source information to distinguish which elements may be incorrect.","accuracy"
C5.1,"GrossOutlayAmountByAwardFYB = GrossOutlaysUndeliveredOrdersPrepaidTotalFYB + GrossOutlaysDeliveredOrdersPaidTotalFYB for the same TAS/DEFC combination.",n,award_financial,warning,,c5_award_financial_1,"Within File C, GrossOutlayAmountByProgramObjectClass_FYB (File C) should equal GrossOutlaysUndeliveredOrdersPrepaidTotal_FYB (File C) + GrossOutlaysDeliveredOrdersPaidTotal_FYB (File C) for the same TAS/DEFC combination. This rule is unable to determine which element is incorrect, just that they differ.","accuracy"
C5.2,"GrossOutlayAmountByAwardCPE = GrossOutlaysUndeliveredOrdersPrepaidTotalCPE - GrossOutlaysUndeliveredOrdersPrepaidTotalFYB + GrossOutlaysDeliveredOrdersPaidTotalCPE - GrossOutlaysDeliveredOrdersPaidTotalFYB for the same TAS/DEFC combination. Note: This rule does not apply if GrossOutlayAmountByAward_CPE is the only non-zero value provided on a non-TOA (balance) row on File C.",n,award_financial,warning,,c5_award_financial_2,"Within File C, GrossOutlayAmountByProgramObjectClass_CPE (File C) should reflect year-to-date activity as of the end of the reporting period, by subtracting GrossOutlaysUndeliveredOrdersPrepaidTotal_FYB and GrossOutlaysDeliveredOrdersPaidTotal_FYB from their CPE counterparts for the same TAS/DEFC combination. This rule is unable to determine which element is incorrect, just that they differ.","accuracy"
C6.1,"GrossOutlaysUndeliveredOrdersPrepaidTotalFYB = USSGL4802 for the same TAS/DEFC combination. This applies to the award level.",n,award_financial,warning,,c6_award_financial_1,"Within File C, GrossOutlaysUndeliveredOrdersPrepaidTotal_FYB should equal USSGL 4802_FYB for the same TAS/DEFC combination. However, the Broker cannot determine which element is incorrect in this rule. Refer to your source information to distinguish which elements may be incorrect.","accuracy"
C6.2,"GrossOutlaysUndeliveredOrdersPrepaidTotalCPE = USSGL(4802 + 4832+ 4882) for the same TAS/DEFC combination. This applies to the award level.",n,award_financial,warning,,c6_award_financial_2,"Within File C, GrossOutlaysUndeliveredOrdersPrepaidTotal_CPE should equal USSGL 4802_CPE + 4832_CPE + 4882_CPE for the same TAS/DEFC combination. However, the Broker cannot determine which element is incorrect in this rule. Refer to your source information to distinguish which elements may be incorrect.","accuracy"
C7.1,"GrossOutlaysDeliveredOrdersPaidTotalFYB = USSGL4908 for the same TAS/DEFC combination. This applies to the award level.",n,award_financial,warning,,c7_award_financial_1,"Within File C, GrossOutlaysDeliveredOrdersPaidTotal_FYB should equal USSGL 4908_FYB for the same TAS/DEFC combination. However, the Broker cannot determine which element is incorrect in this rule. Refer to your source information to distinguish which elements may be incorrect.","accuracy"
C7.2,"GrossOutlaysDeliveredOrdersPaidTotalCPE = USSGL(4902 + 4908 + 4982) for the same TAS/DEFC combination. This applies to the award level.",n,award_financial,warning,,c7_award_financial_2,"Within File C, GrossOutlaysDeliveredOrdersPaidTotal_CPE should equal USSGL 4902_CPE + 4908_CPE + 4982_CPE for the same TAS/DEFC combination. However, the Broker cannot determine which element is incorrect in this rule. Refer to your source information to distinguish which elements may be incorrect.","accuracy"
C8,"Unique FAIN or URI from file C should exist in file D2. Note that in File C: 1) FAIN must be null for aggregate records; and 2) URI must be null for non-aggregate records and PII-redacted non-aggregate records. Note that this only compares award identifiers when the TransactionObligatedAmount is not null.",y,award_financial,warning,award,c8_award_financial,"(See SQL file)","completeness"
C9,"Unique FAIN or URI from file D2 should exist in file C, except for: 1) Loans (AssistanceType = 07 or 08) with OriginalLoanSubsidyCost <= 0 in D2; or 2) Non-Loans with FederalActionObligation = 0 in D2. For non-aggregate and PII-redacted non-aggregate records, only the FAIN in D2 will be compared to C. For aggregate records, only the URI in D2 will be compared to C. Note that for File C, FAIN and URI cannot be provided on the same row.",y,award,warning,award_financial,c9_award_financial,"(See SQL file)","completeness"
C11,"Each unique PIID (or combination of PIID/ParentAwardId) from file C should exist in file D1. Note that this only compares award identifiers when the TransactionObligatedAmount is not null.",y,award_financial,warning,award_procurement,c11_cross_file,"(See SQL file)","completeness"
C12,"Each unique PIID (or combination of PIID/ParentAwardId) from file D1 should exist in file C during the same reporting period, except D1 records where FederalActionObligation = 0.",y,award_procurement,warning,award_financial,c12_cross_file,"(See SQL file)","completeness"
C14.1,"Must provide either FAIN, URI, or PIID",n,award_financial,fatal,,c14_award_financial_1,"Each row provided in file C must contain either a FAIN, URI, or PIID. Rows must not contain a PIID and FAIN, or a PIID and URI.","completeness"
C14.2,"Row must not contain both PIID and FAIN, both a PIID and URI or both a FAIN and URI.",n,award_financial,fatal,,c14_award_financial_2,"Each row provided in file C must contain either a FAIN, URI, or PIID. Rows must not contain a PIID and FAIN, or a PIID and URI.","existence"
C17,"TransactionObligatedAmount and USSGL related balances and subtotals cannot be provided on the same row. Please note that this rule will apply for any non-null (non-blank) value provided, including zero (0).",n,award_financial,fatal,,c17_award_financial,"The value for TransactionObligatedAmount cannot be populated on this row since it contains values for USSGL related elements or subtotals.","existence"
C18,"DeobligationsRecoveriesRefundsOfPriorYearByAward_CPE in File C = USSGL(4871+ 4872 + 4971 + 4972) in File C for the same reporting period. This applies to the award level. Please note that this rule will only apply when all 4 USSGL accounts have a non-null (non-blank) value provided (with zero (0) being considered non-blank).",n,award_financial,warning,,c18_award_financial,"Within File C, DeobligationsRecoveriesRefundsOfPriorYearByProgramObjectClass_CPE should equal the amounts provided in File C for USSGL(4871_CPE+ 4872_CPE + 4971_CPE + 4972_CPE). The Broker cannot distinguish which element is correct for this rule; the agency should review its source information.","accuracy"
C20,"Each USSGL account balance or subtotal, when totaled by combination of TAS, object class code, and direct/reimbursable flag provided in File C, should be a subset of, or equal to, the same combinations in File B.",y,award_financial,warning,program_activity,c20_award_financial,"(See SQL file)","existence"
C21,"Each USSGL account balance or subtotal, when totaled by combination of TAS/program activity name/program activity code provided in File C, should be a subset of, or equal to, the same combinations in File B.",y,award_financial,warning,program_activity,c21_award_financial,"(See SQL file)","existence"
C23.1,"For each unique PIID in File C, the sum of each TransactionObligatedAmount should match (but with opposite signs) the sum of the FederalActionObligation reported in D1. This rule does not apply if the AllocationTransferAgencyIdentifier (ATA) field is populated and is different from the AgencyIdentifier (AID). Note that this only compares award identifiers when the TransactionObligatedAmount is not null.",y,award_financial,warning,award_procurement,c23_award_financial_1,"(See SQL file)","accuracy"
C23.2,"For each unique combination of PIID/ParentAwardId in File C, the sum of each TransactionObligatedAmount should match (but with opposite signs) the sum of the FederalActionObligation reported in D1. This rule does not apply if the AllocationTransferAgencyIdentifier (ATA) field is populated and is different from the AgencyIdentifier (AID). Note that this only compares award identifiers when the TransactionObligatedAmount is not null.",y,award_financial,warning,award_procurement,c23_award_financial_2,"(See SQL file)","accuracy"
C23.3,"For each unique FAIN in File C, the sum of each TransactionObligatedAmount should match (but with opposite signs) the sum of the FederalActionObligation or OriginalLoanSubsidyCost amounts reported in D2. This rule does not apply if the AllocationTransferAgencyIdentifier (ATA) field is populated and is different from the AgencyIdentifier (AID). Note that this only compares award identifiers when the TransactionObligatedAmount is not null.",y,award_financial,warning,award,c23_award_financial_3,"(See SQL file)","accuracy"
C23.4,"For each unique URI in File C, the sum of each TransactionObligatedAmount should match (but with opposite signs) the sum of the FederalActionObligation or OriginalLoanSubsidyCost amounts reported in D2. This rule does not apply if the AllocationTransferAgencyIdentifier (ATA) field is populated and is different from the AgencyIdentifier (AID). Note that this only compares award identifiers when the TransactionObligatedAmount is not null.",y,award_financial,warning,award,c23_award_financial_4,"(See SQL file)","accuracy"
C25,"Prior to FY22, if the DisasterEmergencyFundCode (DEFC) element has a valid COVID-19 related code and the row is a balance row, then GrossOutlayAmountByAward_CPE cannot be blank. Beginning in FY22, if the row is a non-TOA (balance) row, then GrossOutlayAmountByAward_CPE cannot be blank.",n,award_financial,fatal,,c25_award_financial,"GrossOutlayByAward_CPE is required for this valid DEFC and blank TOA.","existence"
C26,"Each USSGL account balance or subtotal, when totaled by combination of TAS/DEFC provided in File C, should be a subset of, or equal to, the same combinations in File B.",y,award_financial,warning,program_activity,c26_award_financial,"(See SQL file)","existence"
C27,"The File C GrossOutlayAmountByAward_CPE balance for a TAS, DEFC, program activity code + name, object class code, direct/reimbursable flag, and Award ID combination should continue to be reported in subsequent periods during the FY, once it has been submitted to DATA Act, unless the most recently reported outlay balance for this award breakdown was zero. This only applies to File C outlays, not TOA. Note that there are occasions where a program activity name can justifiably change mid-FY.",n,award_financial,warning,,c27_award_financial,"GrossOutlayByAward_CPE from previous period must exist this period","completeness"
C28,"The combination of TAS/object class/program activity code+name/reimbursable flag/DEFC/Award ID in File C (award financial) must be unique for USSGL-related balances.",n,award_financial,fatal,,c28_award_financial,"The combination of TAS/object class/program activity code+name/reimbursable flag/DEFC/Award ID in File C must be unique.","existence"
C29,"The File C GeneralLedgerPostDate must be blank for non-TOA (balance) rows.",n,award_financial,fatal,,c29_award_financial,"(blank)","accuracy"
C30,"Beginning in FY25, if the row is a non-TOA (balance) row, then USSGL487200_DownwardAdjustmentsOfPriorYearPrepaidAdvancedUndeliveredOrdersObligationsRefundsCollected_CPE and USSGL497200_DownwardAdjustmentsOfPriorYearPaidDeliveredOrdersObligationsRefundsCollected_CPE cannot be blank.",n,award_financial,fatal,,c30_award_financial,"non-blank USSGL487200_DownwardAdjustmentsOfPriorYearPrepaidAdvancedUndeliveredOrdersObligationsRefundsCollected_CPE and USSGL497200_DownwardAdjustmentsOfPriorYearPaidDeliveredOrdersObligationsRefundsCollected_CPE","accuracy"
FABS1.1,"FAIN is required for non-aggregate and PII-redacted non-aggregate records (RecordType = 2 or 3).",n,fabs,fatal,,fabs1_1,"FAIN is required for this RecordType.","completeness"
FABS1.2,"FAIN must not be used for aggregate records (RecordType = 1).",n,fabs,fatal,,fabs1_2,"FAIN must not be provided for this RecordType.","existence"
FABS2.1,"The combination of FAIN, AwardModificationAmendmentNumber, URI, CFDA_Number, and AwardingSubTierAgencyCode must be unique within the submission file.",n,fabs,fatal,,fabs2_1,"The combination of FAIN, AwardModificationAmendmentNumber, URI, CFDA_Number, and AwardingSubTierAgencyCode must be unique for each row within the submission file.","existence"
FABS2.2.1,"The combination of FAIN, AwardModificationAmendmentNumber, URI, CFDA_Number, and AwardingSubTierAgencyCode must be unique when compared to currently published data--unless the record is a correction or deletion (i.e., if CorrectionDeleteIndicator = C or D). In this particular case, the combination of these five fields in this transaction has already been published in USAspending, making this second attempt a duplicate.",n,fabs,fatal,,fabs2_2_1,"The combination of FAIN, AwardModificationAmendmentNumber, URI, CFDA_Number, and AwardingSubTierAgencyCode must be unique when compared to currently published data.","existence"
FABS2.2.2,"The unique combination of FAIN, AwardModificationAmendmentNumber, URI, CFDA_Number, and AwardingSubTierAgencyCode must exist as a currently published record when the record is a correction (i.e., if CorrectionDeleteIndicator = C).",n,fabs,fatal,,fabs2_2_2,"The combination of FAIN, AwardModificationAmendmentNumber, URI, CFDA_Number, and AwardingSubTierAgencyCode must be unique when compared to currently published data.","existence"
FABS2.2.3,"The unique combination of FAIN, AwardModificationAmendmentNumber, URI, CFDA_Number, and AwardingSubTierAgencyCode must exist as a currently published record when the record is a deletion (i.e., if CorrectionDeleteIndicator = D).",n,fabs,fatal,,fabs2_2_3,"The combination of FAIN, AwardModificationAmendmentNumber, URI, CFDA_Number, and AwardingSubTierAgencyCode must be unique when compared to currently published data.","existence"
FABS3.2,"ActionType must contain one of the following values: ""A"", ""B"", ""C"", ""D"", ""E"".",n,fabs,fatal,,fabs3_2,"A, B, C, D, or E","completeness"
FABS3.3,"ActionType should be B, C, or D for transactions that modify existing awards. For aggregate (RecordType = 1) record transactions, we consider a record a modification if its combination of URI + AwardingSubTierAgencyCode matches an existing published FABS record of the same RecordType. For non-aggregate (RecordType = 2 or 3) transactions, we consider a record a modification if its combination of FAIN + AwardingSubTierCode matches those of an existing published non-aggregate FABS record (RecordType = 2 or 3) of the same RecordType. This rule does not trigger for correction records (those with CorrectionDeleteIndicator = C).",n,fabs,warning,,fabs3_3,"B, C, or D","existence"
FABS3.4,"ActionType = E is only valid for mixed aggregate records (RecordType = 1).",n,fabs,fatal,,fabs3_4,"RecordType = 1 when ActionType = E","accuracy"
FABS3.5,"ActionType should be ""A"" for the initial transaction of a new, non-aggregate award (RecordType = 2 or 3) and ""A"" or ""E"" for a new aggregate award (RecordType = 1). An aggregate record transaction is considered the initial transaction of a new award if it contains a unique combination of URI + AwardingSubTierAgencyCode when compared to currently published FABS records of the same RecordType. A non-aggregate (RecordType = 2 or 3) transaction is considered the initial transaction of a new award if it contains a unique combination of FAIN + AwardingSubTierAgencyCode when compared to currently published non-aggregate FABS records (RecordType = 2 or 3) of the same RecordType. This rule does not trigger for correction records (those with CorrectionDeleteIndicator = C).",n,fabs,warning,,fabs3_5,"A for aggregate, A or E for non-aggregate","accuracy"
FABS4.1,"ActionDate must follow YYYYMMDD format, where YYYY is the year, MM the month and DD the day.",n,fabs,fatal,,fabs4_1,"ActionDate must follow YYYYMMDD format","accuracy"
FABS4.2,"Value of ActionDate must be between 19991001 and 20991231 (i.e., a date between 10/01/1999 and 12/31/2099).",n,fabs,fatal,,fabs4_2,"Between 10/1/1999 and 12/31/2099","accuracy"
FABS4.3,"A future ActionDate is valid only if it occurs within the current fiscal year",n,fabs,fatal,,fabs4_3,"Less than or equal to September 30 of the current fiscal year","accuracy"
FABS5,"AssistanceType field must contain one of the following values: ""02"", ""03"", ""04"", ""05"", ""06"", ""07"", ""08"", ""09"", ""10"", or ""11"".",n,fabs,fatal,,fabs5,"""02,"" ""03"", ""04"", ""05"", ""06"", ""07"", ""08"", ""09"", ""10"", or ""11"".","accuracy"
FABS6,"RecordType field must contain one of the following values: ""1"", ""2"", or ""3"".",n,fabs,fatal,,fabs6,"""1,"" ""2"" or ""3"".","accuracy"
FABS7,"URI is a required field for aggregate records (RecordType = 1).",n,fabs,fatal,,fabs7,"URI is required for this RecordType","completeness"
FABS9.1,"AwardeeOrRecipientLegalEntityName must contain ""MULTIPLE RECIPIENTS"" for aggregate records (RecordType = 1).",n,fabs,fatal,,fabs9_1,"MULTIPLE RECIPIENTS","accuracy"
FABS9.2,"AwardeeOrRecipientLegalEntityName must contain ""REDACTED DUE TO PII"" for PII-redacted non-aggregate records (RecordType = 3).",n,fabs,fatal,,fabs9_2,"REDACTED DUE TO PII","accuracy"
FABS10.1,"LegalEntityAddressLine1 is required for non-aggregate records (RecordType = 2).",n,fabs,fatal,,fabs10_1,"LegalEntityAddressLine1 is required for this RecordType.","completeness"
FABS10.2,"LegalEntityAddressLine1 must be blank for aggregate and PII-redacted non-aggregate records (RecordType = 1 or 3).",n,fabs,fatal,,fabs10_2,"(blank)","accuracy"
FABS11,"LegalEntityAddressLine2 is optional, but must be blank for aggregate and PII-redacted non-aggregate records (RecordType = 1 or 3).",n,fabs,fatal,,fabs11,"(blank) for RecordType 1 or 3","accuracy"
FABS13.1,"LegalEntityZIP5 must be blank for aggregate records (RecordType = 1).",n,fabs,fatal,,fabs13_1,"(blank) for RecordType 1","accuracy"
FABS13.2,"LegalEntityZIP5 must be blank for foreign recipients (i.e., when LegalEntityCountryCode is not USA).",n,fabs,fatal,,fabs13_2,"(blank)","accuracy"
FABS13.3,"LegalEntityZIP5 is required for domestic recipients (LegalEntityCountryCode = USA) for non-aggregate and PII-redacted non-aggregate records (RecordType = 2 or 3).",n,fabs,fatal,,fabs13_3,"LegalEntityZIP5 is required for this domestic record type.","completeness"
FABS14.1,"LegalEntityZIPLast4 must be blank for aggregate and PII-redacted non-aggregate records (RecordType = 1 or 3).",n,fabs,fatal,,fabs14_1,"(blank) for RecordType 1 or 3","accuracy"
FABS14.2,"LegalEntityZIPLast4 must be blank for foreign recipients (i.e., when LegalEntityCountryCode is not USA).",n,fabs,fatal,,fabs14_2,"(blank)","accuracy"
FABS14.3,"When it exists, LegalEntityZIPLast4 should be provided for domestic recipients (LegalEntityCountryCode = USA) for non-aggregate records (RecordType = 2).",n,fabs,warning,,fabs14_3,"LegalEntityZIPLast4 should be provided for this domestic record type.","completeness"
FABS15.1,"LegalEntityForeignCityName is required for foreign recipients (i.e., when LegalEntityCountryCode is not USA) for non-aggregate and PII-redacted non-aggregate records (RecordType = 2 or 3).",n,fabs,fatal,,fabs15_1,"LegalEntityForeignCityName is required for this record type.","completeness"
FABS15.2,"LegalEntityForeignCityName must be blank for domestic recipients (LegalEntityCountryCode = USA) and for aggregate records (RecordType = 1).",n,fabs,fatal,,fabs15_2,"(blank)","accuracy"
FABS16,"LegalEntityForeignProvinceName must be blank for domestic recipients (LegalEntityCountryCode = USA) and for aggregate records (RecordType = 1).",n,fabs,fatal,,fabs16,"(blank)","accuracy"
FABS17,"LegalEntityForeignPostalCode must be blank for domestic recipients (LegalEntityCountryCode = USA) and for aggregate records (RecordType = 1).",n,fabs,fatal,,fabs17,"(blank)","accuracy"
FABS18,"BusinessTypes must be one to three letters in length. BusinessTypes values must be non-repeated letters from A to X.",n,fabs,fatal,,fabs18,"BusinessTypes values must be non-repeated letters from A to X.","accuracy"
FABS19,"LegalEntityCountryCode must contain a valid three character GENC country code. U.S. Territories and Freely Associated States must be submitted with country code = USA and their state/territory code; they cannot be submitted with their GENC country code. For a list of these territories and more information, see Appendix B of the DAIMS Practices and Procedures.",n,fabs,fatal,,fabs19,"The authoritative source for these codes is the GENC Standard Version 3, Update 4.","completeness"
FABS21.1,"When provided, FundingSubTierAgencyCode must be a valid 4-character sub-tier agency code from the Federal Hierarchy.",n,fabs,fatal,,fabs21_1,"Refer to the GSA IAE Federal Hierarchy","accuracy"
FABS21.2,"If both are submitted, FundingSubTierAgencyCode and FundingOfficeCode must belong to the same FundingAgencyCode (per the Federal Hierarchy).",n,fabs,fatal,,fabs21_2,"Refer to the GSA IAE Federal Hierarchy","accuracy"
FABS22,"When provided, CorrectionDeleteIndicator must contain one of the following values: ""C"" or ""D"".",n,fabs,fatal,,fabs22,"(blank), C, or D","accuracy"
FABS23.1,"When provided, AwardingSubTierAgencyCode must be a valid 4-character sub-tier agency code from the Federal Hierarchy.",n,fabs,fatal,,fabs23_1,"Refer to the GSA IAE Federal Hierarchy","accuracy"
FABS23.2,"If both are submitted, AwardingSubTierAgencyCode and AwardingOfficeCode must belong to the same AwardingAgencyCode (per the Federal Hierarchy).",n,fabs,fatal,,fabs23_2,"Refer to the GSA IAE Federal Hierarchy","accuracy"
FABS23.3,"AwardingSubTierAgencyCode must be provided when AwardingOfficeCode is not provided.",n,fabs,fatal,,fabs23_3,"non-blank AwardingSubTierAgencyCode or AwardingOfficeCode","accuracy"
FABS24.1,"PrimaryPlaceOfPerformanceCountryCode must be blank for PII-redacted non-aggregate records (RecordType = 3).",n,fabs,fatal,,fabs24_1,"(blank)","accuracy"
FABS24.2,"PrimaryPlaceOfPerformanceCountryCode must contain a valid three character GENC country code for aggregate or non-aggregate records (RecordType = 1 or 2). U.S. Territories and Freely Associated States must be submitted with country code = USA and their state/territory code; they cannot be submitted with their GENC country code. For a list of these territories and more information, see Appendix B of the DAIMS Practices and Procedures.",n,fabs,fatal,,fabs24_2,"The authoritative source for these codes is the GENC Standard Version 3, Update 4.","completeness"
FABS26.1,"FederalActionObligation must be blank or 0 for loans (AssistanceType = 07 or 08).",n,fabs,fatal,,fabs26_1,"(blank) or 0","accuracy"
FABS26.2,"FederalActionObligation is required for non-loans (i.e., when AssistanceType is not 07 or 08).",n,fabs,fatal,,fabs26_2,"<>0","completeness"
FABS27,"NonFederalFundingAmount must be blank or 0 for loans (AssistanceType = 07 or 08).",n,fabs,fatal,,fabs27,"(blank) or 0","accuracy"
FABS28.1,"FaceValueOfDirectLoanOrLoanGuarantee is required for loans (AssistanceType = 07 or 08).",n,fabs,fatal,,fabs28_1,"<>0","completeness"
FABS28.2,"FaceValueOfDirectLoanOrLoanGuarantee must be blank or 0 for non-loans (i.e., when AssistanceType is not 07 or 08).",n,fabs,fatal,,fabs28_2,"(blank) or 0","accuracy"
FABS29.1,"OriginalLoanSubsidyCost is required for loans (AssistanceType = 07 or 08).",n,fabs,fatal,,fabs29_1,"<>0","completeness"
FABS29.2,"OriginalLoanSubsidyCost must be blank or 0 for non-loans (i.e., when AssistanceType is not 07 or 08).",n,fabs,fatal,,fabs29_2,"(blank) or 0","accuracy"
FABS30,"BusinessFundsIndicator must contain one of the following values: ""REC"" or ""NON"".",n,fabs,fatal,,fabs30,"""REC"" or ""NON""","completeness"
FABS31.1,"AwardeeOrRecipientUEI Field must be blank for aggregate and PII-redacted non-aggregate records (RecordType = 1 or 3, regardless of the BusinessTypes value) and individual recipients (BusinessTypes includes 'P', regardless of the RecordType value).",n,fabs,fatal,,fabs31_1,"(blank)","accuracy"
FABS31.2.1,"AwardeeOrRecipientUEI is required where ActionDate is after October 1, 2010, unless the record is an aggregate or PII-redacted non-aggregate record (RecordType = 1 or 3) or the recipient is an individual (BusinessTypes includes 'P').",n,fabs,fatal,,fabs31_2_1,"AwardeeOrRecipientUEI is required.","completeness"
